{
  "id": "20260528T123456Z-fix-stale-readme-badge",
  "schema_version": 1,
  "priority": "P2",
  "name": "Fix stale README badge",
  "status": "open",
  "sink": "project",
  "created_at": "2026-05-28T12:34:56Z",
  "created_by_run": "20260528T120000Z-some-other-plan",
  "capture_head": "abc123def456abc1",
  "source_artifact": "z-harness/some-plan/archive/20260528T120000Z/task-T003/diff.patch",
  "prompt_page_link": "pages/20260528T123456Z-fix-stale-readme-badge.md",
  "recommended_command": "/z-fix \"update README badge URL\"",
  "recommended_command_safe_to_retry": true,
  "cited_paths": ["README.md", "scripts/lint.sh"],
  "file_blob_hashes": {
    "README.md": "sha256:a1b2c3d4e5f6a1b2c3d4e5f6a1b2c3d4e5f6a1b2c3d4e5f6a1b2c3d4e5f6a1b2",
    "scripts/lint.sh": "sha256:b2c3d4e5f6a1b2c3d4e5f6a1b2c3d4e5f6a1b2c3d4e5f6a1b2c3d4e5f6a1b2c3"
  },
  "depth": 0,
  "auto_close_eligible": false,
  "completion_mode": null,
  "audit_evidence_path": null,
  "closed_at": null,
  "closed_by_run": null,
  "failure_reason": null,
  "attempt_count": 0,
  "status_history": [
    {
      "ts": "2026-05-28T12:34:56Z",
      "from": null,
      "to": "open",
      "by": "scripts/sink-add.sh"
    }
  ],
  "notion_remote_id": null
}
